{"binding_digest":"sha-256:cccccccccccccccccccccccccccccccccccccccccccccccccccccccccccccccc","binding_kind":"generation","deadline":"2026-08-05T00:00:00.000Z","domain":"event","intent_digest":"sha-256:aaaaaaaaaaaaaaaaaaaaaaaaaaaaaaaaaaaaaaaaaaaaaaaaaaaaaaaaaaaaaaaa","operation_id":"0198cf64-cc00-7000-8000-000000000001","policy_digest":"sha-256:bbbbbbbbbbbbbbbbbbbbbbbbbbbbbbbbbbbbbbbbbbbbbbbbbbbbbbbbbbbbbbbb","profile":"yukh-transcript-backup-obligation/v0.1"}